[
  {
    "year": 1602,
    "date": "4 Jul",
    "forename": "Elnor",
    "surname": "Brookes",
    "age": "",
    "notes": "wife of Edmund"
  },
  {
    "year": 1604,
    "date": "23 Jan",
    "forename": "John",
    "surname": "Trip",
    "age": "",
    "notes": "a poore man"
  },
  {
    "year": 1605,
    "date": "14 Aug",
    "forename": "Katharine",
    "surname": "Edwards",
    "age": "",
    "notes": "wife of Thomas"
  },
  {
    "year": 1606,
    "date": "13 Aug",
    "forename": "Ellen",
    "surname": "Dorrell",
    "age": "",
    "notes": "wife of Thomas"
  },
  {
    "year": 1606,
    "date": "10 Aug",
    "forename": "Elizabeth",
    "surname": "Dorrell",
    "age": "",
    "notes": "d of Thomas"
  },
  {
    "year": 1606,
    "date": "22 Mar",
    "forename": "Mathew",
    "surname": "Yonge",
    "age": "",
    "notes": ""
  },
  {
    "year": 1608,
    "date": "17 Oct",
    "forename": "Thomas",
    "surname": "Walter",
    "age": "",
    "notes": ""
  },
  {
    "year": 1609,
    "date": "20 Apr",
    "forename": "Francys",
    "surname": "Robins",
    "age": "",
    "notes": "wife of Bartholomew"
  },
  {
    "year": 1610,
    "date": "20 Sep",
    "forename": "Joone",
    "surname": "Payne",
    "age": "",
    "notes": "an old poore mayd"
  },
  {
    "year": 1614,
    "date": "10 Oct",
    "forename": "Rose",
    "surname": "Trip",
    "age": "",
    "notes": "wife of Richard"
  },
  {
    "year": 1615,
    "date": "4 Jan",
    "forename": "William",
    "surname": "Welhead",
    "age": "",
    "notes": ""
  },
  {
    "year": 1618,
    "date": "20 May",
    "forename": "Dorothea",
    "surname": "Dorrell",
    "age": "",
    "notes": "wife of William"
  },
  {
    "year": 1618,
    "date": "28 May",
    "forename": "Mabell",
    "surname": "Wade",
    "age": "",
    "notes": "wife of William"
  },
  {
    "year": 1618,
    "date": "20 Feb",
    "forename": "John",
    "surname": "Yonge",
    "age": "",
    "notes": ""
  },
  {
    "year": 1619,
    "date": "4 Sep",
    "forename": "Embelin",
    "surname": "Paine",
    "age": "",
    "notes": ""
  },
  {
    "year": 1619,
    "date": "2 Dec",
    "forename": "Mabell",
    "surname": "Hoford",
    "age": "",
    "notes": "d of Francis"
  },
  {
    "year": 1620,
    "date": "10 Nov",
    "forename": "Joane",
    "surname": "Hester",
    "age": "",
    "notes": "wife of James"
  },
  {
    "year": 1621,
    "date": "12 Jul",
    "forename": "James",
    "surname": "Hester",
    "age": "",
    "notes": ""
  },
  {
    "year": 1623,
    "date": "21 Mar",
    "forename": "Christopher",
    "surname": "Bigge",
    "age": "",
    "notes": ""
  },
  {
    "year": 1624,
    "date": "27 May",
    "forename": "William",
    "surname": "Bowden",
    "age": "",
    "notes": ""
  },
  {
    "year": 1624,
    "date": "12 Jan",
    "forename": "Audrie",
    "surname": "Brookes",
    "age": "",
    "notes": "wife of Edmund"
  },
  {
    "year": 1626,
    "date": "11 Apr",
    "forename": "Edward",
    "surname": "Walter",
    "age": "",
    "notes": ""
  },
  {
    "year": 1626,
    "date": "13 Aug",
    "forename": "Steven",
    "surname": "Gomm",
    "age": "",
    "notes": ""
  },
  {
    "year": 1627,
    "date": "4 Nov",
    "forename": "Richard",
    "surname": "Heiborne",
    "age": "",
    "notes": ""
  },
  {
    "year": 1627,
    "date": "10 Mar",
    "forename": "Frances",
    "surname": "Wade",
    "age": "",
    "notes": ""
  },
  {
    "year": 1630,
    "date": "9 May",
    "forename": "Dorothea",
    "surname": "Walter",
    "age": "",
    "notes": "d of Mabell widow"
  },
  {
    "year": 1630,
    "date": "15 May",
    "forename": "Elizabeth",
    "surname": "Grazier",
    "age": "",
    "notes": "widdow"
  },
  {
    "year": 1630,
    "date": "31 Jul",
    "forename": "James",
    "surname": "Browne",
    "age": "",
    "notes": ""
  },
  {
    "year": 1632,
    "date": "19 Aug",
    "forename": "Thomas",
    "surname": "Dorrell",
    "age": "",
    "notes": ""
  },
  {
    "year": 1632,
    "date": "4 Oct",
    "forename": "Katherin",
    "surname": "Boudon",
    "age": "",
    "notes": "wid"
  },
  {
    "year": 1633,
    "date": "20 Aug",
    "forename": "John",
    "surname": "Boudon",
    "age": "",
    "notes": "s of William & Anne"
  },
  {
    "year": 1634,
    "date": "20 Jul",
    "forename": "Elizabeth",
    "surname": "Graves",
    "age": "",
    "notes": "d of Francis & Margarett"
  },
  {
    "year": 1635,
    "date": "20 Mar",
    "forename": "Edward",
    "surname": "Gomm",
    "age": "",
    "notes": "s of Edward & Elizabeth"
  },
  {
    "year": 1636,
    "date": "2 Jul",
    "forename": "Annis",
    "surname": "Robbins",
    "age": "",
    "notes": "wife of Bartholomew"
  },
  {
    "year": 1636,
    "date": "30 Nov",
    "forename": "William",
    "surname": "Goddin",
    "age": "",
    "notes": "husbandman"
  },
  {
    "year": 1637,
    "date": "7 Mar",
    "forename": "Edward",
    "surname": "Anglesey",
    "age": "",
    "notes": "miller"
  },
  {
    "year": 1638,
    "date": "2 Apr",
    "forename": "Mabell",
    "surname": "Walter",
    "age": "",
    "notes": "widdow"
  },
  {
    "year": 1638,
    "date": "30 May",
    "forename": "Anne",
    "surname": "Walter",
    "age": "",
    "notes": "widdow sometime wife to Thomas"
  },
  {
    "year": 1638,
    "date": "4 Nov",
    "forename": "Alse",
    "surname": "Webb",
    "age": "",
    "notes": "wife of Egidius"
  },
  {
    "year": 1638,
    "date": "21 Feb",
    "forename": "Edmund",
    "surname": "Brookes",
    "age": "",
    "notes": ""
  },
  {
    "year": 1639,
    "date": "13 Mar",
    "forename": "Lettice",
    "surname": "Dorrell",
    "age": "",
    "notes": ""
  },
  {
    "year": 1640,
    "date": "7 Sep",
    "forename": "Thomas",
    "surname": "Vaudrey",
    "age": "",
    "notes": "s of Thomas & Margett"
  },
  {
    "year": 1640,
    "date": "18 Sep",
    "forename": "John",
    "surname": "Trip",
    "age": "",
    "notes": "husbandman"
  },
  {
    "year": 1640,
    "date": "3 Nov",
    "forename": "Bartholomew",
    "surname": "Robbins",
    "age": "",
    "notes": ""
  },
  {
    "year": 1640,
    "date": "18 Nov",
    "forename": "Thomas",
    "surname": "Dorsett",
    "age": "",
    "notes": "s of Ann wid"
  },
  {
    "year": 1659,
    "date": "21 Sep",
    "forename": "Anne",
    "surname": "Trippe",
    "age": "",
    "notes": "wife of William"
  },
  {
    "year": 1662,
    "date": "1 Sep",
    "forename": "Thomas",
    "surname": "Walter",
    "age": "",
    "notes": "an aged poore man"
  },
  {
    "year": 1675,
    "date": "7 Feb",
    "forename": "Mary",
    "surname": "Bigge",
    "age": "",
    "notes": "spr"
  },
  {
    "year": 1675,
    "date": "5 Mar",
    "forename": "?Mary",
    "surname": "Wade",
    "age": "",
    "notes": ""
  },
  {
    "year": 1675,
    "date": "19 Mar",
    "forename": "Susannah",
    "surname": "Gom",
    "age": "",
    "notes": "d of Thomas"
  },
  {
    "year": 1687,
    "date": "19 Mar",
    "forename": "William",
    "surname": "Bowden",
    "age": "",
    "notes": ""
  },
  {
    "year": 1688,
    "date": "11 Oct",
    "forename": "Richard",
    "surname": "King",
    "age": "",
    "notes": "s of Thomas"
  },
  {
    "year": 1688,
    "date": "25 Oct",
    "forename": "William",
    "surname": "Gomme",
    "age": "",
    "notes": "the elder"
  },
  {
    "year": 1695,
    "date": "16 Jan",
    "forename": "William",
    "surname": "Bowden",
    "age": "",
    "notes": "junr"
  },
  {
    "year": 1696,
    "date": "8 Nov",
    "forename": "Thomas",
    "surname": "Gomme",
    "age": "",
    "notes": "an ancient man"
  },
  {
    "year": 1698,
    "date": "17 Sep",
    "forename": "",
    "surname": "Kirby",
    "age": "",
    "notes": "d of John a farmer an unbaptized infant"
  },
  {
    "year": 1700,
    "date": "11 Feb",
    "forename": "Edward",
    "surname": "Vaudrey",
    "age": "",
    "notes": "s of Thomas & Mary"
  },
  {
    "year": 1701,
    "date": "6 Jan",
    "forename": "John",
    "surname": "Edwards",
    "age": "",
    "notes": "lab"
  },
  {
    "year": 1703,
    "date": "10 Oct",
    "forename": "Mary",
    "surname": "Gomme",
    "age": "",
    "notes": "widdowe"
  },
  {
    "year": 1703,
    "date": "8 Mar",
    "forename": "",
    "surname": "Gomm",
    "age": "",
    "notes": "a s of William junr was born Mch 5 and dying suddenly unbaptized"
  },
  {
    "year": 1704,
    "date": "26 Mar",
    "forename": "William",
    "surname": "Gomme",
    "age": "",
    "notes": "senr"
  },
  {
    "year": 1704,
    "date": "13 Jun",
    "forename": "Mary",
    "surname": "Gomm",
    "age": "",
    "notes": "widdow who laid violent hand upon her selfe"
  },
  {
    "year": 1704,
    "date": "2 Oct",
    "forename": "Anne",
    "surname": "Syrman",
    "age": "",
    "notes": "wife of Thomas of Sanderton"
  },
  {
    "year": 1704,
    "date": "15 Feb",
    "forename": "Thomas",
    "surname": "Gomm",
    "age": "",
    "notes": "of Longwick in the Parish of Princes Risborough"
  },
  {
    "year": 1705,
    "date": "28 Dec",
    "forename": "Elizabeth",
    "surname": "Gomm",
    "age": "",
    "notes": "d of the widdow of Longwick in the Psh of Princes Risborough"
  },
  {
    "year": 1705,
    "date": "3 Feb",
    "forename": "Elleanour",
    "surname": "Gomm",
    "age": "",
    "notes": "widdow"
  },
  {
    "year": 1706,
    "date": "27 Jun",
    "forename": "Steven",
    "surname": "Gomm",
    "age": "",
    "notes": "s of Edward"
  },
  {
    "year": 1706,
    "date": "28 Nov",
    "forename": "Thomas",
    "surname": "Vaudrey",
    "age": "",
    "notes": ""
  },
  {
    "year": 1708,
    "date": "27 Apr",
    "forename": "Mary",
    "surname": "Walter",
    "age": "",
    "notes": ""
  },
  {
    "year": 1708,
    "date": "2 Sep",
    "forename": "Sarah",
    "surname": "Andrews",
    "age": "",
    "notes": ""
  },
  {
    "year": 1709,
    "date": "18 Jun",